{
  "consent_granted": true,
  "engine_version": "EB2-1.0.0",
  "enum_bundle_version": "EB2-1.0.0",
  "phase1_schema_version": "1.0.0",
  "actor_type": "athlete",
  "execution_scope": "individual",
  "activity_id": "powerlifting",
  "nd_mode": false,
  "instruction_density": "standard",
  "exposure_prompt_density": "standard",
  "bias_mode": "none",
  "constraints": {
    "constraints_version": "1.0.0",
    "available_equipment": [
      "barbell",
      "rack",
      "flat_bench",
      "plates",
      "dumbbells",
      "adjustable_bench",
      "cable_high_low"
    ],
    "avoid_joint_stress_tags": [
      "knee_flexion_deep",
      "spine_flexion_loaded"
    ]
  }
}
