{
  "consent_granted": true,
  "engine_version": "EB2-1.0.0",
  "enum_bundle_version": "EB2-1.0.0",
  "phase1_schema_version": "1.0.0",
  "actor_type": "athlete",
  "execution_scope": "individual",
  "activity_id": "powerlifting",
  "nd_mode": false,
  "instruction_density": "standard",
  "exposure_prompt_density": "standard",
  "bias_mode": "none",
  "constraints": {
    "constraints_version": "1.0.0",
    "goal_id": "strength",
    "schedule": {
      "days_per_week": 3,
      "session_timebox_minutes": 45
    },
    "preferences": {
      "consistency_variety": "consistency",
      "volume_cap": "standard"
    },
    "pain_probe_state": {
      "has_active_pain": true,
      "active_pain_sites": ["knee"],
      "probe_consent": true
    },
    "avoid_joint_stress_tags": ["knee"],
    "available_equipment": [
      "barbell",
      "rack",
      "bench_press_bench",
      "plates"
    ],
    "banned_equipment": []
  }
}