{
  "consent_granted": true,
  "engine_version": "EB2-1.0.0",
  "enum_bundle_version": "EB2-1.0.0",
  "phase1_schema_version": "1.0.0",
  "actor_type": "athlete",
  "execution_scope": "individual",
  "activity_id": "powerlifting",
  "nd_mode": false,
  "instruction_density": "standard",
  "exposure_prompt_density": "standard",
  "bias_mode": "none"
}